{
  "project_id": "CATMAN-RU-DR-2024-2026",
  "run_id": "SWARM-RUN-V2-20260817-002",
  "orchestrator": "Gemini-Spark-Swarm-Orchestrator",
  "started_at": "2026-08-17T09:30:00Z",
  "completed_at": "2026-08-17T10:04:30Z",
  "specialist_runs": [
    {
      "agent_id": "U01",
      "external_run_id": "RUN-U01-9FE769ED",
      "wave": "W0_FOUNDATION",
      "started_at": "2026-08-17T00:23:43Z",
      "completed_at": "2026-08-17T00:26:10Z",
      "input_files": [
        "MASTER_BRIEF_RU_CATMAN_DEMAND_2024_2026.md",
        "prompts/COMMON_POLICY.xml"
      ],
      "output_files": [
        "01_retailer_universe.json",
        "01_universe_decision.md"
      ],
      "status": "completed",
      "retry_count": 0
    },
    {
      "agent_id": "O01",
      "external_run_id": "RUN-O01-D48A34E2",
      "wave": "W0_FOUNDATION",
      "started_at": "2026-08-17T00:23:44Z",
      "completed_at": "2026-08-17T00:28:18Z",
      "input_files": [
        "MASTER_BRIEF_RU_CATMAN_DEMAND_2024_2026.md",
        "prompts/COMMON_POLICY.xml"
      ],
      "output_files": [
        "02_ontology.json",
        "02_ontology_notes.md"
      ],
      "status": "completed",
      "retry_count": 0
    },
    {
      "agent_id": "R01",
      "external_run_id": "RUN-R01-E74296E5",
      "wave": "W1_COLLECTION",
      "started_at": "2026-08-17T00:28:32Z",
      "completed_at": "2026-08-17T00:31:44Z",
      "input_files": [
        "01_retailer_universe.json",
        "02_ontology.json"
      ],
      "output_files": [
        "R01_sources.jsonl",
        "R01_evidence.jsonl"
      ],
      "status": "completed",
      "retry_count": 0
    },
    {
      "agent_id": "R02",
      "external_run_id": "RUN-R02-F8F94B57",
      "wave": "W1_COLLECTION",
      "started_at": "2026-08-17T00:28:33Z",
      "completed_at": "2026-08-17T00:32:27Z",
      "input_files": [
        "01_retailer_universe.json",
        "02_ontology.json"
      ],
      "output_files": [
        "R02_sources.jsonl",
        "R02_evidence.jsonl"
      ],
      "status": "completed",
      "retry_count": 0
    },
    {
      "agent_id": "R03",
      "external_run_id": "RUN-R03-07958019",
      "wave": "W1_COLLECTION",
      "started_at": "2026-08-17T00:28:34Z",
      "completed_at": "2026-08-17T00:32:14Z",
      "input_files": [
        "01_retailer_universe.json",
        "02_ontology.json"
      ],
      "output_files": [
        "R03_sources.jsonl",
        "R03_evidence.jsonl"
      ],
      "status": "completed",
      "retry_count": 0
    },
    {
      "agent_id": "R04",
      "external_run_id": "RUN-R04-DCB9A53E",
      "wave": "W1_COLLECTION",
      "started_at": "2026-08-17T00:28:35Z",
      "completed_at": "2026-08-17T00:33:09Z",
      "input_files": [
        "01_retailer_universe.json",
        "02_ontology.json"
      ],
      "output_files": [
        "R04_sources.jsonl",
        "R04_evidence.jsonl"
      ],
      "status": "completed",
      "retry_count": 0
    },
    {
      "agent_id": "R05",
      "external_run_id": "RUN-R05-5C6A0714",
      "wave": "W1_COLLECTION",
      "started_at": "2026-08-17T00:28:36Z",
      "completed_at": "2026-08-17T00:32:29Z",
      "input_files": [
        "01_retailer_universe.json",
        "02_ontology.json"
      ],
      "output_files": [
        "R05_sources.jsonl",
        "R05_evidence.jsonl"
      ],
      "status": "completed",
      "retry_count": 0
    },
    {
      "agent_id": "R06",
      "external_run_id": "RUN-R06-E39B460F",
      "wave": "W1_COLLECTION",
      "started_at": "2026-08-17T00:28:36Z",
      "completed_at": "2026-08-17T00:33:51Z",
      "input_files": [
        "01_retailer_universe.json",
        "02_ontology.json"
      ],
      "output_files": [
        "R06_sources.jsonl",
        "R06_evidence.jsonl"
      ],
      "status": "completed",
      "retry_count": 0
    },
    {
      "agent_id": "R07",
      "external_run_id": "RUN-R07-039DFEC8",
      "wave": "W1_COLLECTION",
      "started_at": "2026-08-17T00:28:37Z",
      "completed_at": "2026-08-17T00:32:47Z",
      "input_files": [
        "01_retailer_universe.json",
        "02_ontology.json"
      ],
      "output_files": [
        "R07_sources.jsonl",
        "R07_evidence.jsonl"
      ],
      "status": "completed",
      "retry_count": 0
    },
    {
      "agent_id": "R08",
      "external_run_id": "RUN-R08-B549102A",
      "wave": "W1_COLLECTION",
      "started_at": "2026-08-17T00:34:09Z",
      "completed_at": "2026-08-17T00:38:14Z",
      "input_files": [
        "01_retailer_universe.json",
        "02_ontology.json"
      ],
      "output_files": [
        "R08_sources.jsonl",
        "R08_evidence.jsonl"
      ],
      "status": "completed",
      "retry_count": 0
    },
    {
      "agent_id": "R09",
      "external_run_id": "RUN-R09-CCEAC544",
      "wave": "W1_COLLECTION",
      "started_at": "2026-08-17T00:34:09Z",
      "completed_at": "2026-08-17T00:39:25Z",
      "input_files": [
        "01_retailer_universe.json",
        "02_ontology.json"
      ],
      "output_files": [
        "R09_sources.jsonl",
        "R09_evidence.jsonl"
      ],
      "status": "completed",
      "retry_count": 0
    },
    {
      "agent_id": "R10",
      "external_run_id": "RUN-R10-2011F1DA",
      "wave": "W1_COLLECTION",
      "started_at": "2026-08-17T00:34:10Z",
      "completed_at": "2026-08-17T00:39:36Z",
      "input_files": [
        "01_retailer_universe.json",
        "02_ontology.json"
      ],
      "output_files": [
        "R10_sources.jsonl",
        "R10_evidence.jsonl"
      ],
      "status": "completed",
      "retry_count": 0
    },
    {
      "agent_id": "X01",
      "external_run_id": "RUN-X01-EC458E6C",
      "wave": "W1_COLLECTION",
      "started_at": "2026-08-17T00:34:11Z",
      "completed_at": "2026-08-17T00:36:35Z",
      "input_files": [
        "01_retailer_universe.json",
        "02_ontology.json"
      ],
      "output_files": [
        "X01_sources.jsonl",
        "X01_evidence.jsonl"
      ],
      "status": "completed",
      "retry_count": 0
    },
    {
      "agent_id": "X02",
      "external_run_id": "RUN-X02-79FE606C",
      "wave": "W1_COLLECTION",
      "started_at": "2026-08-17T00:34:12Z",
      "completed_at": "2026-08-17T00:38:38Z",
      "input_files": [
        "01_retailer_universe.json",
        "02_ontology.json"
      ],
      "output_files": [
        "X02_sources.jsonl",
        "X02_evidence.jsonl"
      ],
      "status": "completed",
      "retry_count": 0
    },
    {
      "agent_id": "X03",
      "external_run_id": "RUN-X03-D49F7EA9",
      "wave": "W1_COLLECTION",
      "started_at": "2026-08-17T00:34:13Z",
      "completed_at": "2026-08-17T00:40:51Z",
      "input_files": [
        "01_retailer_universe.json",
        "02_ontology.json"
      ],
      "output_files": [
        "07_video_registry.jsonl",
        "X03_sources.jsonl",
        "X03_evidence.jsonl"
      ],
      "status": "completed",
      "retry_count": 0
    },
    {
      "agent_id": "X04",
      "external_run_id": "RUN-X04-C81037E8",
      "wave": "W1_COLLECTION",
      "started_at": "2026-08-17T00:34:14Z",
      "completed_at": "2026-08-17T00:40:50Z",
      "input_files": [
        "01_retailer_universe.json",
        "02_ontology.json"
      ],
      "output_files": [
        "X04_sources.jsonl",
        "X04_evidence.jsonl"
      ],
      "status": "completed",
      "retry_count": 0
    },
    {
      "agent_id": "F01",
      "external_run_id": "RUN-F01-71B892D0",
      "wave": "W2_FACT_CHECK",
      "started_at": "2026-08-17T00:41:41Z",
      "completed_at": "2026-08-17T00:53:08Z",
      "input_files": [
        "03_source_registry_raw.jsonl",
        "04_evidence_raw.jsonl"
      ],
      "output_files": [
        "F01_fact_checks.jsonl",
        "F01_exceptions.md"
      ],
      "status": "completed",
      "retry_count": 0
    },
    {
      "agent_id": "F02",
      "external_run_id": "RUN-F02-4A9B10EF",
      "wave": "W2_FACT_CHECK",
      "started_at": "2026-08-17T00:41:42Z",
      "completed_at": "2026-08-17T00:51:10Z",
      "input_files": [
        "03_source_registry_raw.jsonl",
        "04_evidence_raw.jsonl"
      ],
      "output_files": [
        "F02_fact_checks.jsonl",
        "F02_exceptions.md"
      ],
      "status": "completed",
      "retry_count": 0
    },
    {
      "agent_id": "F03",
      "external_run_id": "RUN-F03-C2192626",
      "wave": "W2_FACT_CHECK",
      "started_at": "2026-08-17T00:41:43Z",
      "completed_at": "2026-08-17T00:49:59Z",
      "input_files": [
        "03_source_registry_raw.jsonl",
        "04_evidence_raw.jsonl"
      ],
      "output_files": [
        "F03_fact_checks.jsonl",
        "F03_exceptions.md"
      ],
      "status": "completed",
      "retry_count": 0
    },
    {
      "agent_id": "N01",
      "external_run_id": "RUN-N01-21FA5A7A",
      "wave": "W3_ANALYSIS",
      "started_at": "2026-08-17T00:53:30Z",
      "completed_at": "2026-08-17T00:59:16Z",
      "input_files": [
        "06_evidence_verified.jsonl",
        "06_dataset_freeze_manifest.json"
      ],
      "output_files": [
        "N01_claims.jsonl",
        "N01_analysis.md"
      ],
      "status": "completed",
      "retry_count": 0
    },
    {
      "agent_id": "N02",
      "external_run_id": "RUN-N02-357E18CA",
      "wave": "W3_ANALYSIS",
      "started_at": "2026-08-17T00:53:31Z",
      "completed_at": "2026-08-17T00:59:44Z",
      "input_files": [
        "06_evidence_verified.jsonl",
        "06_dataset_freeze_manifest.json"
      ],
      "output_files": [
        "N02_claims.jsonl",
        "N02_analysis.md"
      ],
      "status": "completed",
      "retry_count": 0
    },
    {
      "agent_id": "N03",
      "external_run_id": "RUN-N03-01EEF748",
      "wave": "W3_ANALYSIS",
      "started_at": "2026-08-17T00:53:34Z",
      "completed_at": "2026-08-17T01:02:10Z",
      "input_files": [
        "06_evidence_verified.jsonl",
        "06_dataset_freeze_manifest.json"